{
  "$schema": "../../schemas/test-case.schema.json",
  "title": "Basic emphasis",
  "description": "Emphasized text (typically rendered as italic)",
  "category": "inline",
  "formats": {
    "oxa": {
      "type": "Emphasis",
      "children": [
        { "type": "Text", "value": "emphasized text" }
      ]
    },
    "myst-ast": {
      "type": "emphasis",
      "children": [
        { "type": "text", "value": "emphasized text" }
      ]
    },
    "pandoc-types": {
      "t": "Emph",
      "c": [
        { "t": "Str", "c": "emphasized text" }
      ]
    },
    "stencila-schema": {
      "type": "Emphasis",
      "content": [
        { "type": "Text", "value": "emphasized text" }
      ]
    },
    "markdown": "*emphasized text*",
    "myst-markdown": "*emphasized text*",
    "stencila-markdown": "*emphasized text*",
    "quarto-markdown": "*emphasized text*",
    "html": "<em>emphasized text</em>",
    "jats": "<italic>emphasized text</italic>"
  },
  "notes": {
    "markdown": "Also accepts _emphasized text_ as input",
    "myst-markdown": "Equivalent to markdown for this node type",
    "stencila-markdown": "Equivalent to markdown for this node type",
    "quarto-markdown": "Equivalent to markdown for this node type"
  }
}
