{
  "$schema": "../../schemas/test-case.schema.json",
  "title": "Basic reference",
  "description": "A bibliographic reference with CSL-JSON data",
  "category": "block",
  "formats": {
    "oxa": {
      "type": "Reference",
      "id": "jones2022",
      "children": [{ "type": "Text", "value": "Jones and Chen (2022)." }],
      "csl": {
        "id": "jones2022",
        "citation-key": "jones2022",
        "type": "article-journal",
        "title": "A Framework for Open Science",
        "author": [
          { "given": "Alice", "family": "Jones" },
          { "given": "Bob", "family": "Chen" }
        ],
        "issued": { "date-parts": [[2022]] }
      }
    },
    "html": "<div id=\"jones2022\" role=\"doc-biblioentry\">Jones and Chen (2022).</div>",
    "jats": "<ref id=\"jones2022\"><element-citation publication-type=\"journal\"><article-title>A Framework for Open Science</article-title></element-citation></ref>"
  }
}
